{
  "version": 1,
  "idempotencyKey": "request-voice.send",
  "contextId": "context-1",
  "operation": "voice.send",
  "arguments": {
    "space": {
      "version": 1,
      "id": "space-1",
      "scope": {
        "projectId": "project-1",
        "provider": "imessage",
        "accountId": "account-1",
        "lineId": "line-1",
        "spaceId": "space-1"
      },
      "kind": "space"
    },
    "media": {
      "stagingId": "staged-1",
      "sha256": "aaaaaaaaaaaaaaaaaaaaaaaaaaaaaaaaaaaaaaaaaaaaaaaaaaaaaaaaaaaaaaaa",
      "mimeType": "image/png",
      "bytes": 20
    }
  }
}
